{
  "description": "Switch DaVinci Resolve to the Edit page (Shift+4).",
  "verify_mode": "soft",
  "steps": [
    {"action": "activate_app", "name": "DaVinci Resolve", "settle_ms": 500},
    {"action": "hotkey", "combo": ["shift", "4"]},
    {"action": "wait", "ms": 600}
  ],
  "return": {"success": true, "page": "edit"}
}
