{
  "description": "Switch DaVinci Resolve to the Fairlight (audio) page (Shift+7).",
  "verify_mode": "soft",
  "steps": [
    {"action": "activate_app", "name": "DaVinci Resolve", "settle_ms": 500},
    {"action": "hotkey", "combo": ["shift", "7"]},
    {"action": "wait", "ms": 600}
  ],
  "return": {"success": true, "page": "fairlight"}
}
