{
  "description": "Switch DaVinci Resolve to the Deliver page (Shift+8).",
  "verify_mode": "soft",
  "steps": [
    {"action": "activate_app", "name": "DaVinci Resolve", "settle_ms": 500},
    {"action": "hotkey", "combo": ["shift", "8"]},
    {"action": "wait", "ms": 600}
  ],
  "return": {"success": true, "page": "deliver"}
}
