{
  "description": "Switch DaVinci Resolve to the Fusion page (Shift+5).",
  "verify_mode": "soft",
  "steps": [
    {"action": "activate_app", "name": "DaVinci Resolve", "settle_ms": 500},
    {"action": "hotkey", "combo": ["shift", "5"]},
    {"action": "wait", "ms": 600}
  ],
  "return": {"success": true, "page": "fusion"}
}
